{
  "$schema": "http://json-schema.org/draft-04/schema#",
  "definitions": {},
  "id": "http://example.com/example.json",
  "properties": {
    "analyst_email": {
      "default": "siwells@gmail.com",
      "description": "An explanation about the purpose of this instance.",
      "id": "/properties/analyst_email",
      "minLength": 5,
      "title": "The analyst_email schema",
      "type": "string"
    },
    "analyst_name": {
      "default": "Simon Wells",
      "description": "An explanation about the purpose of this instance.",
      "id": "/properties/analyst_name",
      "minLength": 5,
      "title": "The analyst_name schema",
      "type": "string"
    },
    "created": {
      "default": "2017-07-11T16:32:36",
      "description": "An explanation about the purpose of this instance.",
      "id": "/properties/created",
      "title": "The created schema",
      "type": "string"
    },
    "edges": {
      "id": "/properties/edges",
      "items": {
        "id": "/properties/edges/items",
        "properties": {
          "id": {
            "default": "d7bcef81-0d74-4ae5-96f9-bfb07031f1fa",
            "description": "An explanation about the purpose of this instance.",
            "id": "/properties/edges/items/properties/id",
            "title": "The id schema",
            "type": "string"
          },
          "source_id": {
            "default": "49a786ce-9066-4230-8e18-42086882a160",
            "description": "An explanation about the purpose of this instance.",
            "id": "/properties/edges/items/properties/source_id",
            "title": "The source_id schema",
            "type": "string"
          },
          "target_id": {
            "default": "9bfb7cdc-116f-47f5-b85d-ff7c5d329f45",
            "description": "An explanation about the purpose of this instance.",
            "id": "/properties/edges/items/properties/target_id",
            "title": "The target_id schema",
            "type": "string"
          }
        },
        "type": "object"
      },
      "type": "array"
    },
    "edited": {
      "default": "2017-07-11T16:32:36",
      "description": "An explanation about the purpose of this instance.",
      "id": "/properties/edited",
      "title": "The edited schema",
      "type": "string"
    },
    "id": {
      "default": "94a975db-25ae-4d25-93cc-1c07c932e2f8",
      "description": "An explanation about the purpose of this instance.",
      "id": "/properties/id",
      "title": "The id schema",
      "type": "string"
    },
    "metadata": {
      "id": "/properties/metadata",
      "properties": {
        "description": "This accepts anything, as long as it's valid JSON.",
        "title": "Empty Object"
      },
      "type": "object"
    },
    "nodes": {
      "id": "/properties/nodes",
      "items": {
        "id": "/properties/nodes/items",
        "properties": {
          "id": {
            "default": "9bfb7cdc-116f-47f5-b85d-ff7c5d329f45",
            "description": "An explanation about the purpose of this instance.",
            "id": "/properties/nodes/items/properties/id",
            "title": "The id schema",
            "type": "string"
          },
          "metadata": {
            "id": "/properties/nodes/items/properties/metadata",
            "properties": {
              "description": "This accepts anything, as long as it's valid JSON.",
              "title": "Empty Object"
            },
            "type": "object"
          },
          "sources": {
            "id": "/properties/nodes/items/properties/sources",
            "items": {
              "description": "This accepts anything, as long as it's valid JSON.",
              "title": "Empty Object"
            },
            "type": "array"
          },
          "text": {
            "default": "The 'Hang Back' campaign video should not have been published, and should be withdrawn.",
            "description": "An explanation about the purpose of this instance.",
            "id": "/properties/nodes/items/properties/text",
            "title": "The text schema",
            "type": "string"
          },
          "type": {
            "default": "atom",
            "description": "An explanation about the purpose of this instance.",
            "id": "/properties/nodes/items/properties/type",
            "title": "The type schema",
            "type": "string"
          }
        },
        "type": "object"
      },
      "type": "array"
    },
    "resources": {
      "id": "/properties/resources",
      "items": {
        "description": "This accepts anything, as long as it's valid JSON.",
        "title": "Empty Object"
      },
      "type": "array"
    }
  },
  "required": [
    "resources",
    "id",
    "nodes",
    "edges",
    "created",
    "analyst_email",
    "analyst_name",
    "edited"
  ],
  "type": "object"
}