{
  "edited": "veniam voluptate sed",
  "analyst_name": "dolore non qui elit sunt",
  "analyst_email": "icara@abv.bg",
  "created": "consequat adipisicing ex proident voluptate",
  "edges": [
    {
      "source": "voluptate velit nisi eiusmod consectetur",
      "id": "ut commodo dolore laboris sit",
      "target": "labori"
    },
    {
      "source": "esse reprehenderit",
      "id": "fugiat est in",
      "target": "aliquip laborum eu"
    },
    {
      "source": "voluptate quis dolore in",
      "id": "in adipisicing",
      "target": "Duis aliquip tempor fugiat ad"
    },
    {
      "source": "dolor Lorem",
      "id": "Duis laboris cillum",
      "target": "est laboris voluptate dolore"
    }
  ],
  "nodes": [
    {
      "sources": [
        {
          "text": "id reprehenderit",
          "length": 34368693,
          "resource_id": "sunt",
          "offset": 1249330
        },
        {
          "text": "qui",
          "length": -9803922,
          "resource_id": "consectetur",
          "offset": 29607391
        }
      ],
      "type": "exercitation consequat in",
      "id": "enim elit in",
      "canonical_text": "enim"
    },
    {
      "sources": [
        {
          "text": "voluptate",
          "length": 87361190,
          "resource_id": "exercitation in Ut anim sint",
          "offset": 60910708
        },
        {
          "text": "dolor",
          "length": -12916350,
          "resource_id": "et consequat se",
          "offset": -57680106
        },
        {
          "text": "voluptate dolor mollit consectetur eu",
          "length": -1179942,
          "resource_id": "ut Ut",
          "offset": 96935431
        }
      ],
      "type": "",
      "id": "eu irure ullamco Excepteur",
      "canonical_text": "mollit cillum ea"
    }
  ],
  "id": "do commodo anim",
  "resources": [
    {
      "content": "in ",
      "type": "labore Ut adipisicing",
      "id": "irure ut amet eiusmod"
    },
    {
      "content": "",
      "type": "ad adipisicing",
      "id": "non officia dolore nisi"
    },
    {
      "content": "Lorem magna sed",
      "type": "sit",
      "id": "et tempor o"
    },
    {
      "content": "ut Ut anim labore",
      "type": "dolore",
      "id": "consequat dolore Excepteur id"
    },
    {
      "content": "Exc",
      "type": "velit ci",
      "id": "nostrud"
    }
  ],
  "metadata": {
    "some": "ut",
    "hello": "in cillum nostrud incididunt aliquip"
  }
}